{
  "version": "2.0.0",
  "generatedAt": "2025-12-16T17:12:35.570Z",
  "source": "University Hall_0-1.png",
  "floorName": "University Hall Level 1",
  "floorNumber": 1,
  "imageSize": {
    "width": 3400,
    "height": 2200
  },
  "rooms": [
    {
      "id": "room_1",
      "name": "101",
      "bbox": [
        100,
        200,
        80,
        60
      ],
      "center": [
        140,
        230
      ]
    },
    {
      "id": "room_2",
      "name": "102",
      "bbox": [
        200,
        200,
        80,
        60
      ],
      "center": [
        240,
        230
      ]
    },
    {
      "id": "room_3",
      "name": "103",
      "bbox": [
        300,
        200,
        80,
        60
      ],
      "center": [
        340,
        230
      ]
    },
    {
      "id": "room_4",
      "name": "104",
      "bbox": [
        400,
        200,
        80,
        60
      ],
      "center": [
        440,
        230
      ]
    },
    {
      "id": "room_5",
      "name": "105",
      "bbox": [
        500,
        200,
        80,
        60
      ],
      "center": [
        540,
        230
      ]
    },
    {
      "id": "room_6",
      "name": "106",
      "bbox": [
        100,
        270,
        80,
        60
      ],
      "center": [
        140,
        300
      ]
    },
    {
      "id": "room_7",
      "name": "107",
      "bbox": [
        200,
        270,
        80,
        60
      ],
      "center": [
        240,
        300
      ]
    },
    {
      "id": "room_8",
      "name": "108",
      "bbox": [
        300,
        270,
        80,
        60
      ],
      "center": [
        340,
        300
      ]
    },
    {
      "id": "room_9",
      "name": "109",
      "bbox": [
        400,
        270,
        80,
        60
      ],
      "center": [
        440,
        300
      ]
    },
    {
      "id": "room_10",
      "name": "110",
      "bbox": [
        500,
        270,
        80,
        60
      ],
      "center": [
        540,
        300
      ]
    },
    {
      "id": "room_11",
      "name": "111",
      "bbox": [
        100,
        340,
        80,
        60
      ],
      "center": [
        140,
        370
      ]
    },
    {
      "id": "room_12",
      "name": "112",
      "bbox": [
        200,
        340,
        80,
        60
      ],
      "center": [
        240,
        370
      ]
    },
    {
      "id": "room_13",
      "name": "113",
      "bbox": [
        300,
        340,
        80,
        60
      ],
      "center": [
        340,
        370
      ]
    },
    {
      "id": "room_14",
      "name": "114",
      "bbox": [
        400,
        340,
        80,
        60
      ],
      "center": [
        440,
        370
      ]
    },
    {
      "id": "room_15",
      "name": "115",
      "bbox": [
        500,
        340,
        80,
        60
      ],
      "center": [
        540,
        370
      ]
    },
    {
      "id": "room_16",
      "name": "116",
      "bbox": [
        100,
        410,
        80,
        60
      ],
      "center": [
        140,
        440
      ]
    },
    {
      "id": "room_17",
      "name": "117",
      "bbox": [
        200,
        410,
        80,
        60
      ],
      "center": [
        240,
        440
      ]
    },
    {
      "id": "room_18",
      "name": "118",
      "bbox": [
        300,
        410,
        80,
        60
      ],
      "center": [
        340,
        440
      ]
    },
    {
      "id": "room_19",
      "name": "119",
      "bbox": [
        400,
        410,
        80,
        60
      ],
      "center": [
        440,
        440
      ]
    },
    {
      "id": "room_20",
      "name": "120",
      "bbox": [
        500,
        410,
        80,
        60
      ],
      "center": [
        540,
        440
      ]
    },
    {
      "id": "room_21",
      "name": "121",
      "bbox": [
        100,
        480,
        80,
        60
      ],
      "center": [
        140,
        510
      ]
    },
    {
      "id": "room_22",
      "name": "122",
      "bbox": [
        200,
        480,
        80,
        60
      ],
      "center": [
        240,
        510
      ]
    },
    {
      "id": "room_23",
      "name": "123",
      "bbox": [
        300,
        480,
        80,
        60
      ],
      "center": [
        340,
        510
      ]
    },
    {
      "id": "room_24",
      "name": "124",
      "bbox": [
        400,
        480,
        80,
        60
      ],
      "center": [
        440,
        510
      ]
    },
    {
      "id": "room_25",
      "name": "125",
      "bbox": [
        500,
        480,
        80,
        60
      ],
      "center": [
        540,
        510
      ]
    },
    {
      "id": "room_26",
      "name": "126",
      "bbox": [
        100,
        550,
        80,
        60
      ],
      "center": [
        140,
        580
      ]
    },
    {
      "id": "room_27",
      "name": "127",
      "bbox": [
        200,
        550,
        80,
        60
      ],
      "center": [
        240,
        580
      ]
    },
    {
      "id": "room_28",
      "name": "128",
      "bbox": [
        300,
        550,
        80,
        60
      ],
      "center": [
        340,
        580
      ]
    },
    {
      "id": "room_29",
      "name": "129",
      "bbox": [
        400,
        550,
        80,
        60
      ],
      "center": [
        440,
        580
      ]
    },
    {
      "id": "room_30",
      "name": "130",
      "bbox": [
        500,
        550,
        80,
        60
      ],
      "center": [
        540,
        580
      ]
    }
  ],
  "corridors": [
    {
      "id": "hall_1",
      "polygon": [
        [
          100,
          260
        ],
        [
          600,
          260
        ],
        [
          600,
          300
        ],
        [
          100,
          300
        ]
      ]
    },
    {
      "id": "hall_2",
      "polygon": [
        [
          100,
          330
        ],
        [
          600,
          330
        ],
        [
          600,
          370
        ],
        [
          100,
          370
        ]
      ]
    },
    {
      "id": "hall_3",
      "polygon": [
        [
          100,
          400
        ],
        [
          600,
          400
        ],
        [
          600,
          440
        ],
        [
          100,
          440
        ]
      ]
    },
    {
      "id": "hall_4",
      "polygon": [
        [
          100,
          480
        ],
        [
          600,
          480
        ],
        [
          600,
          520
        ],
        [
          100,
          520
        ]
      ]
    },
    {
      "id": "hall_5",
      "polygon": [
        [
          100,
          550
        ],
        [
          600,
          550
        ],
        [
          600,
          590
        ],
        [
          100,
          590
        ]
      ]
    }
  ],
  "doors": [
    {
      "id": "door_1",
      "roomId": "room_1",
      "connectsToCorridor": true,
      "position": [
        184,
        260
      ],
      "corridorId": "hall_1"
    },
    {
      "id": "door_2",
      "roomId": "room_2",
      "connectsToCorridor": true,
      "position": [
        284,
        260
      ],
      "corridorId": "hall_1"
    },
    {
      "id": "door_3",
      "roomId": "room_3",
      "connectsToCorridor": true,
      "position": [
        384,
        260
      ],
      "corridorId": "hall_1"
    },
    {
      "id": "door_4",
      "roomId": "room_4",
      "connectsToCorridor": true,
      "position": [
        484,
        260
      ],
      "corridorId": "hall_1"
    },
    {
      "id": "door_5",
      "roomId": "room_6",
      "connectsToCorridor": true,
      "position": [
        184,
        330
      ],
      "corridorId": "hall_1"
    },
    {
      "id": "door_6",
      "roomId": "room_7",
      "connectsToCorridor": true,
      "position": [
        284,
        330
      ],
      "corridorId": "hall_1"
    },
    {
      "id": "door_7",
      "roomId": "room_8",
      "connectsToCorridor": true,
      "position": [
        384,
        330
      ],
      "corridorId": "hall_1"
    },
    {
      "id": "door_8",
      "roomId": "room_9",
      "connectsToCorridor": true,
      "position": [
        484,
        330
      ],
      "corridorId": "hall_1"
    },
    {
      "id": "door_9",
      "roomId": "room_11",
      "connectsToCorridor": true,
      "position": [
        184,
        400
      ],
      "corridorId": "hall_1"
    },
    {
      "id": "door_10",
      "roomId": "room_12",
      "connectsToCorridor": true,
      "position": [
        284,
        400
      ],
      "corridorId": "hall_1"
    }
  ],
  "stairs": [
    {
      "id": "stairs_1",
      "label": "STAIR",
      "bbox": [
        50,
        100,
        60,
        80
      ],
      "center": [
        80,
        140
      ]
    },
    {
      "id": "stairs_2",
      "label": "STAIR",
      "bbox": [
        600,
        100,
        60,
        80
      ],
      "center": [
        630,
        140
      ]
    }
  ],
  "elevators": [
    {
      "id": "elev_1",
      "label": "Elevator",
      "bbox": [
        120,
        100,
        40,
        50
      ],
      "center": [
        140,
        125
      ]
    }
  ],
  "graph": {
    "nodes": [
      {
        "id": "node_room_1",
        "type": "room",
        "position": [
          140,
          230
        ],
        "label": "101",
        "entityId": "room_1"
      },
      {
        "id": "node_room_2",
        "type": "room",
        "position": [
          240,
          230
        ],
        "label": "102",
        "entityId": "room_2"
      },
      {
        "id": "node_room_3",
        "type": "room",
        "position": [
          340,
          230
        ],
        "label": "103",
        "entityId": "room_3"